Title,Authors,Abstract,Published Year,Published Month,Journal,Volume,Issue,Pages,Accession Number,DOI,Ref,Covidence #,Study,Notes,Tags
Underestimation of the authigenic fraction of Cu and Ni in organic-rich sediments,"Böning, P; Fröllje, H; Beck, M; Schnetger, B; Brumsack, HJ","There are two possible techniques to estimate the degree of authigenic (or non-lithogenic) metal enrichment in sediments. First, the authigenic metal fraction can be calculated according to M-auth = M-total - (M/Al-background center dot Al-total) while M is the metal of interest and Al is aluminum. Second, a metal enrichment factor (EF) is calculated according to EF = M/Al-total/M/Al-background. Both techniques rely on the appropriate use of the M/Al ratio of the lithogenic background. For the latter, the M/Al ratio of average shale or crust is widely applied as lithogenic background in marine geochemistry. However, as we show here, the lithogenic background based on average shale or crust is too high for Cu and Ni. As a consequence, the authigenic fraction of Cu and Ni in sediments and suspended particulate matter (SPM) is significantly underestimated as shown for examples from various environments (upwelling areas of Peru, Chile and the Gulf of California, the Norwegian Kyllaren fjord and the German Wadden Sea). By correlating Cu/Al and Ni/Al with TOC in the samples the apparent M/Al ratio of the background can be estimated. A prerequisite for this technique is high linearity and high quality of correlation (r(2)>= 0.8) otherwise the lithogenic background cannot be exactly determined. The resulting higher authigenic level of Cu and Ni may promote their use as productivity indicators while the status of Cu and Ni may shift from moderately to highly enriched when the enrichment is assessed via EFs. (C) 2012 Elsevier B.V. All rights reserved.",2012,,MARINE GEOLOGY,323,,24-28,WOS:000310123700003,10.1016/j.margeo.2012.07.004,,#234,Böning 2012,"Sam Welch (2025-07-18 18:58:42)(Select): like, 10% of their study sites are Norwegian, so if we need to down-prioritise manuscripts for extraction this should be one of them; ",Cu environmental chemistry; marine; sediment
"Seasonal and Spatial Differences in Metal and Metalloid Concentrations in the Snow Cover of Hansbreen, Svalbard","Koziol, K; Uszczyk, A; Pawlak, F; Frankowski, M; Polkowska, Z","Metals and metalloids in snow on glaciers, depending on the season of deposition, may come from various sources: local rock dust (erosion of the geological substratum), marine aerosol, local human activity (e.g., impurities in combusted fuel and waste incineration), and long-range atmospheric transport. Hansbreen, a glacier located close to the Polish Polar Station in southern Svalbard, is a perfect site to study metals and metalloids: it has a complex geological substratum, has a year-round presence of a small group of people, and is near the coast. We analyzed a snapshot of metal and metalloid concentrations in snow samples from shallow cores corresponding to autumn, winter, and spring deposition on Hansbreen. Eighteen cores of snow were collected across the glacier, revealing the influence of potential local sources of metals and metalloids. In these samples, we predominantly found Na, Mg, and K, followed by Zn, Ca, Al, and Fe. Heavy metals, such as Bi or Hg, were also detected. Cluster analysis of the determined elemental concentrations divided them into three distinct groups: Group 1: Ag, As, Bi, Cd, Hg, Mo, Sb, Se, and Zn-the most diverse cluster, representing mostly long-range transported volatile elements, with possible extra local geological sources; Group 2: Al, Fe, Cu, and Mn-elements with crustal sources; and Group 3: Na, Ca, Mg, K, and Sr-with the main source in sea spray aerosol. The latter interpretation was confirmed by the calculation of sea salt contribution based on the composition of mean seawater and the positive significant correlation between their concentrations and the electrical conductivity of snow samples. In the study site, snow was up to six times more efficient in bringing metal pollution into terrestrial environment, when compared to rain.",2021,,FRONTIERS IN EARTH SCIENCE,8,,,WOS:000612329100001,10.3389/feart.2020.538762,,#243,Koziol 2021,,marine; primary source; terrestrial
"Major ions and trace metals in glacial meltwaters nearby Ny-Ålesund, Svalbard","Shen, Z; Ye, LP; Zhang, J; Ma, HM; Zhang, RF","Ny-& Aring;lesund, located in Arctic Svalbard, is one of the most sensitive areas on Earth to global warming. In recent years, accelerated glacier ablation has become remarkable in Ny-& Aring;lesund. Glacial meltwaters discharge a substantial quantity of materials to the ocean, affecting downstream ecosystems and adjacent oceans. In August 2015, various water samples were taken near Ny-& Aring;lesund, including ice marginal meltwater, proglacial meltwater, supraglacial meltwater, englacial meltwater, and groundwater. Trace metals (Al, Cr, Mn, Fe, Co, Cu, Zn, Cd, and Pb), major ions, alkalinity, pH, dissolved oxygen, water temperature and electric conductivity were also measured. Major ions were mainly controlled by chemical weathering intensity and reaction types, while trace metals were influenced by both chemical weathering and physicochemical control upon their mobility. Indeed, we found that Br & oslash;ggerbreen was dominated by carbonate weathering via carbonation of carbonate, while Austre Lov & eacute;nbreen and Pedersenbreen were dominated by sulfide oxidation coupled with carbonate dissolution with a doubled silicate weathering. The higher enrichment of trace metals in supraglacial meltwater compared to ice marginal and proglacial meltwater suggested anthropogenic pollution from atmospheric deposition. In ice marginal and proglacial meltwater, principal component analysis indicated that trace metals like Cr, Al, Co, Mn and Cd were correlated to chemical weathering. This implies that under accelerated glacier retreat, glacier-derived chemical components are subjected to future changes in weathering types and intensity.",2024,,ACTA OCEANOLOGICA SINICA,43,10,86-99,WOS:001378325100001,10.1007/s13131-024-2385-9,,#244,Shen 2024,,freshwater; terrestrial
"Metals in Racomitrium lanuginosum from Arctic (SW Spitsbergen, Svalbard archipelago) and alpine (Karkonosze, SW Poland) tundra","Wojtun, B; Samecka-Cymerman, A; Kolon, K; Kempers, AJ","Arctic-alpine tundra habitats are very vulnerable to the input of relatively small amounts of xenobiotics, and thus their level in such areas must be carefully controlled. Therefore, we collected the terrestrial widespread moss Racomitrium lanuginosum (Hedw.) Brid. in Spitsbergen in the Arctic moss lichen tundra and, for comparison, in the Arctic-alpine tundra in the Karkonosze (SW Poland). Concentrations of the elements Cd, Co, Cr, Cu, Fe, Hg, Li, Mn, Mo, Na, Ni, Pb, V, and Zn in this species and in the parent rock material were measured. We tested the following hypothesis: R. lanuginosum from Spitsbergen contains lower metal levels than the species from the Karkonosze collected at altitudes influenced by long-range transport from former Black Triangle industry. Principal component and classification analysis (PCCA) ordination revealed that mosses of Spitsbergen were distinguished by a significantly higher Na concentration of marine spray origin and mosses of Karkonosze were distinguished by significantly higher concentrations of Cd, Cr, Cu, Fe, Hg, Li, Mn, Pb, V, and Zn probably from long-range atmospheric transport. The influence of the polar station with a waste incinerator resulted in significantly higher Co, Li, and Ni concentrations in neighbouring mosses in comparison with this species from other sites. This investigation contributes to the use of R. lanuginosum as a bioindicator for metal contamination in Arctic and alpine tundra regions characterised by severe climate habitats with a restricted number of species. This moss enables the control of pollution usually brought solely by long-range atmospheric transport in high mountains as well as in Arctic areas.",2018,,ENVIRONMENTAL SCIENCE AND POLLUTION RESEARCH,25,13,12444-12450,WOS:000431883500023,10.1007/s11356-018-1508-2,,#250,Wojtun 2018,,biota; primary source; terrestrial
"HEAVY-METALS IN WATER, ICE AND BIOLOGICAL-MATERIAL FROM SPITSBERGEN, SVALBARD","DRBAL, K; ELSTER, J; KOMAREK, J","Concentrations of heavy metals Zn, Mn, Cu, Fe, Ni, Cr, Pb, Cd, Hg and Co were determined in surface waters, glacier ice and plant and animal materials from three regions in Spitsbergen, Svalbard. The concentrations of these metals in two samples of surface waters and in the vascular plants from Spitsbergen were found to be lower than what is commonly found in Cental Europe. Elevated concentrations were found in old ice from the surface of a glacier. The concentrations of heavy metals in algae were lower than in vascular plants. The concentrations of metals in the samples of feathers and animal hair from Spitsbergen were higher than what is common for Central Europe.",1992,,POLAR RESEARCH,11,2,99-101,WOS:A1992KR48900007,10.1111/j.1751-8369.1992.tb00416.x,,#270,DRBAL 1992,,biota; freshwater; pre-2010; primary source
"SOME HEAVY-METALS, ESSENTIAL ELEMENTS, AND CHLORINATED HYDROCARBONS IN POLAR BEAR (URSUS-MARITIMUS) AT SVALBARD","NORHEIM, G; SKAARE, JU; WIIG, O","During the period 1978-1989, samples of liver, kidney and subcutaneous fat from 24 polar bears, Ursus maritimus, from Svalbard were analysed for mercury, cadmium, lead, copper, zinc, selenium, arsenic, HCB, DDE, and PCBs (as Aroclor 1260R or Phenoclor DP6R). In a selected number of liver (seven) and fat (three) samples, the composition of individual PCB congeners was studied by comparison with 23 individual PCB congeners (IUPAC nos. 28, 52, 74, 101, 99, 110, 149, 118, 114, 105, 153, 141, 138, 187, 128, 183. 156, 157, 180, 170, 194,206 and 209). In the seven liver samples, the concentrations of o,p'- and p,p'-isomers of DDT, TDE, DDE, alpha-, beta- and gamma-HCH, oxychlordane, heptachlor, heptachlorepoxide, aldrin and dieldrin were also determined. The hepatic concentrations of mercury, cadmium and lead in animals of all ages were 0.4-6.0, < 0.1-1.2, and < 0.5-1.6-mu-g g-1, respectively. This indicates a moderate exposure. Concentrations of mercury and selenium were correlated (r = 0.80). The levels of copper and zinc represented nor-mal physiological concentrations. The concentrations of HCB, DDE and PCBs in fat were < 0.05-1.5, < 0.1-3.4 and 2.9-90-mu-g g-1, respectively. The corresponding results for liver were < 0.01-0.11, < 0.1-0.5 and 0.1-78-mu-g g-1, respectively. Six PCB congeners, PCB-99, -153, -138, -180, -170 and -194 accounted for about 99 and 87% of the total PCB content (sum of the 12 congeners, nos. 28, 99, 153, 138, 128 + 187, 156, 157, 180, 170, 194, 206 and 209) in liver and fat, respectively. PCB-153 represented 37 +/- 3 and 30 +/- 16% of the sum PCB (sum of 12 congeners) in liver and fat, respectively. The range of the hepatic concentration of oxychlordane was 5-19-mu-g g-1. Quantifiable concentrations of heptachlor, heptachlorepoxide, beta-HCH and dieldrin were also found in all the liver samples analysed. Low concentrations of p,p'- and o,p'-DDT were found in two of seven liver and two of two fat samples. Comparisons are made with investigations from Canada and Greenland. Possible effects of PCBs, especially on reproduction, cannot be excluded. Ringed seal, Foca hispida, and to some extent bearded seal, Erignathus barbatus, are the main food of the polar bear. It is therefore likely that the exposure to environmental pollutants occurs via the consumption of these two species.",1992,,ENVIRONMENTAL POLLUTION,77,1,51-57,WOS:A1992HW54700007,10.1016/0269-7491(92)90157-6,,#272,NORHEIM 1992,,Cu biology; biota; marine; pre-2010; primary source
Applying foraminiferal stratigraphy as a biomarker for heavy metal contamination and mining impact in a fiord in West Greenland,"Elberling, B; Knudsen, KL; Kristensen, PH; Asmund, G","Sulphidic mine waste disposed in marine environments constitutes an environmental risk to aquatic life due to potential uptake and accumulation of heavy metals in biota. Fiord sediments near the former Black Angel Mine in West Greenland are contaminated by lead and zinc as a result of submarine tailings disposal in 1973-1990. In 1999 cores were taken up to 10 km away from the disposal area. Analyses include heavy metals, radiochemical dating (Pb-210) and high-resolution foraminiferal stratigraphy. The mining operation resulted in significant changes in the assemblage composition. In addition, up to 20% of the Melonis barleeanus population found in sediment deposited during nearby tailings disposal was deformed compared to a natural background of less than 5%. Throughout cores representing the last 100 years of sedimentation, the total numbers and frequency of morphological abnormalities among M. barleeanus revealed some correlation with heavy metals concentrations (up to r(2) = 79%). We conclude that abnormalities among foraminifera may represent a useful biomarker for evaluating trends in the biological impact resulting of submarine tailings disposal as well as long-term environmental impact and subsequent recovery. (C) 2002 Elsevier Science Ltd. All rights reserved.",2003,,MARINE ENVIRONMENTAL RESEARCH,55,3,235-256,WOS:000180430200004,10.1016/S0141-1136(02)00219-2,,#276,Elberling 2003,PIERRE  BLEVIN (2025-07-10 20:16:53)(Screen): We need to check if there is Cu in there; ,biota; marine; pre-2010; sediment
Speciation of trace elements in discharges from the pulp industry,"Skipperud, L; Salbu, B; Hagebo, E","The concentrations and size distribution pattern of trace elements in wastewater discharged from a pulp industry located at Oslo Fjord, Norway, have been studied. The annual discharge to the fjord amounts to approx. 34 kg Cd, 18 kg Ce, 15 kg Co, 10 kg Cs, 1500 kg Cu, 8200 kg Fe, 150 kg Ni, 420 kg Pb, 1100 kg Rb, 1.2 kg Sc, 3 kg Sm, 5100 kg Sr and 3500 kg Zn. Information on the size-distribution pattern of the trace elements in discharged waste water was obtained using the tangential cross-flow ultrafiltration technique. Instrumental neutron activation analysis, INAA, was employed to determine the concentration levels of Cd, Ce, Co, Cs, Eu, Fe, La, Rb, Sc, Sm, Sr and Zn. Lead, Cu and Ni were measured by atomic absorption spectroscopy with graphite furnace, GFAAS, and inductively coupled plasma atomic emission spectroscopy, ICP-AES. Almost all of the alkali metals Cs and Rb, the alkaline earth metal Sr and also Ni in discharged waste water were found to be present in the low molecular weight fraction. A major fraction of Co, Cu and Pb was present in the low molecular weight fraction, while a significant fraction was found as colloids, particles or both. Cadmium, Fe and Zn in discharge waste water were predominantly present as colloids. Approx. 50% of Sc was present as particles, 100% of Ce was present as particles, and most of the Sm was found as colloids. Due to coastal currents and trace element background levels in coastal water, the contribution of mobile trace elements to Norwegian coastal sea water is probably of minor importance provided that wood from highly contaminated areas is not utilised in the pulp industry. If the particle fraction accumulates outside the outlet, however, a local environmental impact over the years should be expected. (C) 1998 Elsevier Science B.V. All rights reserved.",1998,,SCIENCE OF THE TOTAL ENVIRONMENT,217,3,251-256,WOS:000075060700005,10.1016/S0048-9697(98)00200-9,,#279,Skipperud 1998,,freshwater; pre-2010; primary source; terrestrial
Occurrence of matrix-bound phosphine in polar ornithogenic tundra ecosystems: Effects of alkaline phosphatase activity and environmental variables,"Zhu, RB; Ma, DW; Ding, W; Bai, B; Liu, YS; Sun, JJ","Phosphine (PH3), a reduced phosphorus compound, is a highly toxic and reactive atmospheric trace gas. In this study, a total of ten ornithogenic soil/sediment profiles were collected from tundra ecosystems of east Antarctica and Arctic, and matrix-bound phosphine (MBP), the phosphorus fractions and alkaline phosphatase activity (APA) were analyzed. High MBP concentrations were found in these profiles with the range from 39.59 ng kg(-1) dw to 11.77 mu g kg(-1) dw. MBP showed a consistent vertical distribution pattern in almost all the soil profiles, and its concentrations increased at soil surface layers and then decreased with depths. MBP levels in the ornithogenic soils were two to three orders of magnitude lower than those in ornithogenic sediments. The yield of PH3 as a fraction of total P in all the profiles ranged from 10(-5) to 10(-9) mgPH(3) mg(-1)P with higher mean PH3 yield in the ornithogenic sediments. The ornithogenic soils showed high concentrations of total phosphorus (TP), organic phosphorus (OP), inorganic phosphorus (IP) and metal elements (Cu, Zn, Mn, Fe, Al and Ca) but low MBP levels, vice versa for the ornithogenic sediments. No correlation had been obtained between MBP concentrations and IP, OP and TP. There existed an exponential correlation (r=0.67, p<0.01) between MBP and soil/sediment moisture. MBP concentrations showed a significant positive correlation with APA (r=0.668, p<0.0001), total organic carbon (r=0.501, p<0.0001), total hydrogen (r=0.483, p<0.0001) and total sulfur (r=0.398, p<0.001), indicating that the production of MBP is associated with microbially mediated factors rather than the contents of TP, IP and OP in the P-enriched ornithogenic soils/sediments. Our results indicated that MBP is an important gaseous link in the phosphorus biogeochemical cycles of ornithogenic tundra ecosystems in Antarctica and Arctic. (C) 2011 Elsevier B.V. All rights reserved.",2011,,SCIENCE OF THE TOTAL ENVIRONMENT,409,19,3789-3800,WOS:000295233900024,10.1016/j.scitotenv.2011.06.034,,#281,Zhu 2011,"Sam Welch (2025-07-21 18:23:36)(Select): Svalbard seems to be the arctic destination of choice for Polish, Chinese and Indian labs.; PIERRE  BLEVIN (2025-07-20 04:50:17)(Screen): worth to check where in the Arctic; ",Cu biology; Cu environmental chemistry; primary source; terrestrial
Field contamination of the starfish Asterias rubens by metals.: Part 1:: Short- and long-term accumulation along a pollution gradient,"Coteur, G; Pernet, P; Gillan, D; Joly, G; Maage, A; Dubois, P","The accumulation of Cd, Pb, Zn, and Cu in the starfish Asterias rubens was studied in a Norwegian fjord characterized by a gradient of metal pollution in the sediments, ranging from very high metal concentrations at its head to much lower levels at its opening. The concentrations of metals in starfish from natural populations along the gradient (long-term accumulation) and in starfish that were transferred up the gradient (short-term accumulation) were compared. At long-term, Cd and Pb accumulations by starfish living at normal salinity (30parts per thousand) were related to the level of contamination of the environment while Cu and, to a lesser extent, Zn accumulations appeared strictly controlled. At short-term, Pb was accumulated steadily, Cd and Zn were accumulated transiently in the pyloric caeca (fast compartment), and Cu was not accumulated at all. Depuration experiments (transfer down the gradient) showed that Cd and Pb were efficiently eliminated from the pyloric caeca but not from the body wall (slow compartment). It is concluded that Pb is chronically accumulated, without apparent control, Cd is subjected to a regulating mechanism in the pyloric. caeca which is overwhelmed over the long-term; Zn is tightly controlled in the pyloric caeca and Cu in both pyloric caeca and body wall. A distinct color variety of starfish is restricted to the low salinity (22-26parts per thousand) superficial water layer. This variety showed a different pattern of metal accumulation over the long-term. This pattern is attributed to the particular hydrological conditions prevailing in this upper layer.",2003,,ENVIRONMENTAL TOXICOLOGY AND CHEMISTRY,22,9,2136-2144,WOS:000185639400025,10.1897/02-489,,#282,Coteur 2003,,biota; marine; pre-2010; primary source
Car Tire Crumb Rubber: Does Leaching Produce a Toxic Chemical Cocktail in Coastal Marine Systems?,"Halsband, C; Sorensen, L; Booth, AM; Herzke, D","Crumb rubber granulate (CRG) produced from end of life tires (ELTs) is commonly applied to synthetic turf pitches (STPs), playgrounds, safety surfaces and walkways. In addition to fillers, stabilizers, cross-linking agents and secondary components (e.g., pigments, oils, resins), ELTs contain a range of other organic compound and heavy metal additives. While previous environmental impact studies on CRG have focused on terrestrial soil and freshwater ecosystems, many sites applying CRG in Norway are coastal. The current study investigated the organic chemical and metal additive content of 'pristine' and 'weathered' CRG and their seawater leachates, as well as uptake and effects of leachate exposure using marine copepods (AcartiaandCalanussp.). A combination of pyrolysis gas chromatography mass spectrometry (py-GC-MS) and chemical extraction followed by GC-MS analysis revealed similar organic chemical profiles for pristine and weathered CRG, including additives such as benzothiazole,N-1,3-dimethylbutyl-N '-phenyl-p-phenylenediamine and a range of polycyclic aromatic hydrocarbons (PAHs) and phenolic compounds (e.g., bisphenols). ICP-MS analysis revealed g kg(-1) quantities of Zn and mg kg(-1)quantities of Fe, Mn, Cu, Co, Cr, Pb, and Ni in the CRG. A cocktail of organic additives and metals readily leached from the CRG into seawater, with the most abundant leachate components being benzothiazole and Zn, Fe, Co (metals), as well as detectable levels of PAHs and phenolic compounds. Concentrations of individual components varied with CRG source material and CRG to seawater ratio, but benzothiazole and Zn were typically the organic and metal components present at the highest concentrations in the leachates. While organic chemical concentrations in the leachates stabilized within days, metals continued to leach out over the 30-day period. Marine copepods exposed to high CRG leachate concentrations exhibited high mortalities within 48 h. The smaller lipid-poorAcartiahad a higher sensitivity to leachates than the larger lipid-richCalanus, indicating species-specific differences in vulnerability to leachates. The effect on survival was alleviated at lower leachate concentrations, indicating a dose-response relationship. Benzothiazole and its derivatives appear to be of concern owing to their proven toxicity, while bisphenols are also known to be toxic and were enriched in the leachates relative to the other compounds in the CRG.",2020,,FRONTIERS IN ENVIRONMENTAL SCIENCE,8,,,WOS:000560307900001,10.3389/fenvs.2020.00125,,#287,Halsband 2020,"Sam Welch (2025-07-18 18:24:12)(Select): this is technically a lab/effects study, but to my eye they show Cu leaching from tire crumb rubber to seawater, so it's probably relevant ; ",biota; marine; terrestrial
"Applying Chemometrics to Determine Dispersion of Mine Tailing-Affected Sediments from Submarine Tailing Disposal in Bokfjorden, Northern Norway","Simonsen, AMT; Pedersen, KB; Bach, L; Sternal, B; Junttila, J; Elberling, B","Mine tailing management is one of the largest environmental issues related to mining operation. This study uses chemometrics to assess the dispersion of iron mine tailing-affected sediments in Bokfjorden, Northern Norway. Metal concentrations (Al, As, Cd, Cr, Cu, Fe, Mn, Ni, Pb, Zn) and physico-chemical sediment characteristics (conductivity, organic matter, sulphate, chloride, grain size, CaCO3, pH) were analysed in seven sediment cores collected in a transect out of the fjord along with two reference cores. Results of hierarchical cluster analysis and principal component analysis allowed to distinguish between mine tailing-affected and non-affected sediments. Non-affected sediments were especially characterised by high levels of organic matter whilst mine tailing-affected sediments varied significantly in sediment characteristics depending on location in the fjord. Crucial parameters to reveal mine tailing-affected sediments varied between the target metal Fe along with metals of Cd and Mn, albeit less significant. Variations in mine tailing-affected sediment characteristics could be attributed to other anthropogenic activities in the fjord. Despite potential disturbances, chemometrics made it possible to identify dispersion of mine tailing-affected sediments to cover the inner and middle parts of the fjord. The study demonstrates the advantage of applying chemometrics on complex fjord systems, which in this case was used to distinguish mine tailing-affected sediments from areas with elevated levels of metals not necessarily related to the mine.",2018,,WATER AIR AND SOIL POLLUTION,229,6,,WOS:000435497500024,10.1007/s11270-018-3868-0,,#295,Simonsen 2018,,Cu environmental chemistry; marine; primary source; sediment
