Title,Authors,Abstract,Published Year,Published Month,Journal,Volume,Issue,Pages,Accession Number,DOI,Ref,Covidence #,Study,Notes,Tags
A COMPREHENSIVE ANALYSIS OF THE EFFECTS OF OFFSHORE OIL AND GAS EXPLORATION AND PRODUCTION ON THE BENTHIC COMMUNITIES OF THE NORWEGIAN CONTINENTAL-SHELF,"OLSGARD, F; GRAY, JS","Multivariate statistical analyses of data on environmental variables and benthic fauna from 14 oil and gas fields obtained from 24 surveys collected between 1985 and 1993 are presented. At all fields oil-based drilling mud was used. The purpose of this study was to investigate contamination gradients, assess effects on benthic fauna both spatially and temporally and to evaluate measures such as diversity indices, indicator species and multivariate analysis techniques in assessment of pollution. Results from analyses of baseline surveys of environmental variables and fauna were characterised by a lack of distinct gradients in station placement, having a typical shot-gun pattern in PCA-, DCA- and MDS-ordination analyses. Likewise there was no consistency in which environmental variables correlated with the fauna. Contamination was assessed using all the physical and chemical data in classification and PCA-ordination analyses. Clear patterns were found using 4 categories, conveniently termed initial, moderate, severe and gross. The categories were usually apparent as rings radiating from the platform. Initial contamination of the outermost areas at most fields was shown as elevated levels of barium and total hydrocarbons (THC) and sometimes also by elevated levels of zinc, copper, cadmium and lead. Three fields were studied in particular and showed contaminated areas of over 100 km(2) (Valhall), over 15 km(2) (Gyda) and over 10 km(2) (Veslefrikk). After a period of 6 to 9 yr contamination had spread, so that nearly all of the outermost stations 2 to 6 km away from the platforms showed evidence of contamination. Thus, the existing sampling design is no longer suitable for assessment of the area contaminated. Effects on the fauna showed, as with contamination, 4 categories. Analyses linking fauna and environmental variables indicated that the effects were mainly related to THC, barium and strontium, but also to metals Like zinc, copper, cadmium and lead, which are all discharged in drill-cuttings. Effects on the fauna closely followed the patterns of contamination with only a few stations at each field that were contaminated not showing effects. Thus the areas showing effects were only slightly less than the areas contaminated. Subsequent to cessation of discharges biodegradation of oil and reduced concentrations of THC were observed. Yet there was an extension of areas where the fauna was affected several years after cessation of drill-cutting discharges. This may indicate that barite and related compounds associated with the discharges also have an environmental impact. However, preliminary results from fields using only water-based mud clearly indicate a reduction in environmental contamination and biological impact, compared to effects reported here, for oil-based drill-cuttings. Diversity indices applied to the data did not show the extent of effects and such indices alone should not be used to interpret changes. The consistent patterns that the multivariate techniques were able to detect showed that these methods were far superior. Analyses of the initial effects on the fauna showed that there were no consistent patterns in changes in species composition over fields or time, and thus the search for 'universal' sensitive indicator species does not seem to be rewarding. Yet under gross effects of pollution there were consistent patterns with the same species dominating.Finally, the initial effects of pollution included severe reductions in organisms that are key components of the benthic communities and also food for bottom-living fish, and are thus ecologically important.The new fauna which establishes in the contaminated sediments close to platforms, often with high abundance, will probably be less valuable as a food source for fish populations since it is of small size and lives sub-surface.",1995,,MARINE ECOLOGY PROGRESS SERIES,122,01-Mar,277-306,WOS:A1995RH67200025,10.3354/meps122277,,#464,OLSGARD 1995,,marine; pre-2010; primary source
"High Cu and Cd pollution in sediments from Sisimiut, Greenland. Adsorption to organic matter and fine particles","Ottosen, LM; Villumsen, A","High concentrations of Cu of up to 200 mg/kg, and Cd of up to 4.0 mg/kg, were found in sediments from the aquatic environment around Sisimiut, Greenland. These concentrations are four times higher than the limiting concentration where toxicological effects are expected. The pollution could be linked to human activities in Sisimiut, a link that have not been investigated previously in Greenland. Except from the most polluted samples there was good correlation between heavy metal concentration and organic matter. Also some relationship between fine fraction and heavy metal concentration was observed.",2006,,ENVIRONMENTAL CHEMISTRY LETTERS,4,4,195-199,WOS:000242726100003,10.1007/s10311-006-0045-2,,#467,Ottosen 2006,,marine; pre-2010; primary source; sediment
Occurrence and chemical characteristics of microplastic paint flakes in the North Atlantic Ocean.,Turner A; Ostle C; Wootton M,"Non-fibrous microplastics sampled by the Continuous Plankton Recorder (CPR) Survey throughout the North Atlantic Ocean during 2018 have been recorded and a selection (n = 17, or 16.7%) physically and chemically characterised. The average abundance of non-fibrous particles captured by the plankton silks and detectable by microscopy was estimated to be around 0.01 m(-3), with the highest concentrations evident in shelf seas of northwest Europe. Amongst the samples analysed, median size was 180 μm and, based on visible properties (e.g., brittleness, layering) and infra-red spectra, all but one were identified as flakes of paint. Semi-quantitative analysis by energy-dispersive X-ray fluorescence spectrometry with a collimated beam revealed that six flakes from European shelf seas were Cu-based antifouling formulations (without evidence of organo-Sn compounds), and five with a broader geographical distribution were Pb-based formulations of likely marine origin. Other elements regularly detected included Cr, Fe, Ti and Zn that were present in pigments or as contaminants from the underlying substrate. After fibres, paint flakes appear to be the most abundant type of microplastic in the oceans that, because of the abundance and mobility of metallic additives, deserve closer scientific attention.",2022,Feb,Sci Total Environ,806,Pt 1,150375,,10.1016/j.scitotenv.2021.150375,34563907,#490,Turner 2022,"Sam Welch (2025-07-18 22:49:18)(Select): The flakes have copper in them, and some flakes were sampled from our geo. scope.; Knut Erik Tollefsen Tollefsen (2025-07-16 17:56:14)(Screen): potential source for Cu; ",North Atlantic only; marine
Metals and other trace elements in plasma and feathers of seabirds breeding in Svalbard.,Lundgren SS; Abbasi NA; Waugh CA; Lee MM; Ciesielski TM; Gabrielsen GW; Descamps S; Jaspers VLB,"We assessed the concentrations of metals and other trace elements in two of the most common seabird species breeding on Svalbard, the black-legged kittiwake (Rissa tridactyla) and the Brünnich's guillemot (Uria lomvia). Both of these species feed mostly on fish and crustaceans but have different foraging strategies, kittiwakes being surface feeders while guillemots are divers. We investigated the concentrations of arsenic (As), cadmium (Cd), chromium (Cr), copper (Cu), mercury (Hg), lead (Pb), selenium (Se) and zinc (Zn) in the plasma and body feathers of black-legged kittiwakes (n = 17), as well as in the body feathers of Brünnich's guillemots (n = 13). Samples were collected from adult birds at two time points, one week apart during July 2017 in Kongsfjorden, Svalbard. Of the non-essential trace elements, As was found at the highest median concentration at both the first (56.23 ng/g ww) and second (39.99 ng/g ww) sampling timepoints in the kittiwake plasma. When separating for the sexes, as well as sampling time, males sampled at the first sampling time point had significantly higher concentrations of As (median at 0.087 ng/g versus 0.039 ng/g) and Se (median 0.26 ng/g versus 0.16 ng/g) compared to males sampled at the second time point. There was no significant difference in plasma concentrations between females at first and second sampling time points. Kittiwake feathers contained significantly higher concentrations of As, Cd and Hg than guillemot feathers, while guillemot feathers had significantly higher concentrations of Cu, Pb and Zn. However, of the non-essential elements in both kittiwake and guillemot feathers Hg was found with the highest median concentrations at 5160 and 1080 ng/g, respectively, thus in kittiwakes exceeding the level of 5000 ng/g associated with adverse effect (e.g., impaired reproduction). Levels of Hg and Se found in the kittiwake feathers were higher than previous studies on seabirds in the Arctic.",2024,Nov,Sci Total Environ,952,,175895,,10.1016/j.scitotenv.2024.175895,39218090,#501,Lundgren 2024,,Cu biology; biota; primary source; terrestrial
Spatial distribution and risk assessment of metal(loid)s in marine sediments in the Arctic Ocean and Bering Sea.,Zheng H; Ren Q; Zheng K; Qin Z; Wang Y,"Seventy-four surface sediment samples were collected from the Arctic Ocean and Bering Sea to determine the content of metal(loid)s (As, Cu, Cd, Ni, Pb, Zn and Cr). Metal(loid)s content in these sediments varied from 2.36-41.90 mg/kg for As, 8.63-82.28 mg/kg for Cu, 0.14-0.71 mg/kg for Cd, 11.86-100.60 mg/kg for Ni, 8.30-27.58 mg/kg for Pb, 39.93-391.43 mg/kg for Zn, and 40.96-106.49 mg/kg for Cr. The pH and water-soluble organic carbon content had considerable impacts on the content of metal(loid)s in sediment, but the texture of sediment has limited influence on metal(loid)s content in sediment. In addition, the hotspots of most of these metal(loid)s appeared in the Beaufort Sea region. The geoaccumulation index (I(geo)) indicated that Cd was the metal with the highest contamination in these sediments, with 55.41% of the sample sites posing moderate pollution. The ecological risk for As, Cu, Ni, Pb, Zn and Cr indicates low ecological risk (100%), while Cd posed moderate risk (35.14%), considerable risk (54.05%) and high risk (10.81%) and attributed more than 76.45% of the total potential ecological risk of these metal(loid)s.",2022,Jun,Mar Pollut Bull,179,,113729,,10.1016/j.marpolbul.2022.113729,35537309,#524,Zheng 2022,,marine; primary source; sediment
"Sedimentary processes, metal enrichment and potential ecological risk of metals in lacustrine sediments of Svalbard, Arctic.",Choudhary S; Nayak GN; Khare N,"The Svalbard archipelago is a glacial environment bestowed with various lakes that act as a natural archive for understanding environmental conditions. The accumulation of sediments in lake basins and their distribution are affected by different mechanisms. Therefore, to understand the distribution of sediments, factors controlling the transport and metal enrichment in the lake environment, core sediments were studied from four lakes (L-A, L-1, L-2 and L-3). Also, the potential ecological risk index (PERI) was computed to determine the impact of metal enrichment on the sediment-associated biota. The results obtained showed that the distribution of trace elements was mainly controlled by the major elements like Al, Ti, Fe, and Mn attributed to their lithogenic origin. Index of geoaccumulation (I(geo)) of all four lakes showed a moderate level of enrichment of metals like Cr and Cd indicating an enhanced supply of these metals probably from the catchment rocks and anthropogenic activities. A comparison of metals with Arctic Sediment Quality Guidelines (ASQGs) showed that Cd, Cr and Cu were enriched in the sediments of all the cores indicating the occurrence of adverse biological effects. Furthermore, a potential ecological risk index (PERI) revealed high Cd indicating considerable potential ecological risk to the sediment-associated biota. Thus, trace element influx to the lakes needs to be monitored with due emphasis on Cd contamination.",2023,Oct,Environ Sci Pollut Res Int,30,49,106967-106981,,10.1007/s11356-022-23600-w,36255580,#533,Choudhary 2023,PIERRE  BLEVIN (2025-07-17 04:26:47)(Screen): source to mar eco?; ,freshwater; primary source; sediment; terrestrial
"Exposure of a small Arctic seabird, the little auk (Alle alle) breeding in Svalbard, to selected elements throughout the course of a year.",Pacyna-Kuchta AD; Jakubas D; Frankowski M; Polkowska Ż; Wojczulanis-Jakubas K,"The Arctic marine ecosystem can be altered by processes of natural and anthropogenic origin. Spatio-temporal variation in species exposure to contamination is still poorly understood. Here, we studied elemental concentrations in the non-lethally collected samples from the most numerous seabird in European Arctic, the little auk (Alle alle) nesting in one breeding colony in Svalbard. This seabird spent the breeding season in the high-Arctic zone and the non-breeding period in sub-Arctic areas what may implicate spatio-temporal variation in elements bioaccumulation. We determined concentrations of 19 elements in adults feathers to determine levels of exposure during part of the pre-breeding (n = 74) and post-breeding (n = 74) seasons, feathers from nestlings (n = 18) to determine local contamination, and chick down (n = 16) and post-hatching eggshells (n = 18) to determine maternal input to offspring. During the pre-breeding period adults accumulated in their feathers significantly more Hg (one third of feathers exceeded the established toxicity threshold), Se and Mn compared to the post-breeding period. It reflects a higher exposition of birds to contaminants in pre-breeding moult areas outside the High Arctic compared to the post-breeding moult in the High Arctic. Sex differences in adult feathers representing the post-breeding period were found only for Ca and Zn with higher values in females. Chick down was characterized by high levels of several essential elements, an intermediate level of Hg and Se, and the highest Se:Hg molar ratios of all groups. Chick body feathers had the highest level of Cu and K among all the studied groups. Post-hatching eggshells were characterized by high Sr level (exceeding 2000 μg/g). Concentrations of several non-essential elements (Bi, Cd, Cr, Hg, Ni and Pb) in them were below method detection limits.",2020,Aug,Sci Total Environ,732,,139103,,10.1016/j.scitotenv.2020.139103,32428770,#545,Pacyna-Kuchta 2020,,Cu biology; biota; marine; primary source; terrestrial
"Benthic community status and mobilization of Ni, Cu and Co at abandoned sea deposits for mine tailings in SW Norway.",Schaanning MT; Trannum HC; Øxnevad S; Ndungu K,"During 1960-94 tailings from an ilmenite mine in southwest Norway were placed in sea deposits in a sheltered fjord and a more exposed coastal basin. In 2015 both deposit sites were sampled to assess the state of metal contamination and macrobenthic communities 20-30 years after deposition was ended. The results showed that nickel and copper still exceeded environmental quality standards in sediment and pore water from the 0-1 cm layer, and fluxes of nickel, copper and cobalt to the overlying water was high compared to adjacent reference stations. Fauna communities were classified as good, but moderate disturbance was recorded along an environmental gradient defined by depth and tailings-induced parameters such as particle size and copper. The results were interpreted in terms of current discharges, biological sediment reworking and near-surface leaching of metal sulphides. No evidence was found for recycling of metals from tailings buried below the bioturbated surface layer.",2019,Apr,Mar Pollut Bull,141,,318-331,,10.1016/j.marpolbul.2019.02.047,30955740,#546,Schaanning 2019,,Cu environmental chemistry; marine; primary source; sediment
"Transport and sedimentation of Cu in a microtidal estuary, SE Norway.",Helland A; Bakke T,"The transport and sedimentation of copper in the Glomma estuary, SE Norway during a period of 90% reduction in the industrial input of Cu, was studied from sediment trap material and compared to samples of the bottom sediments. Traps were deployed at four stations for several monthly periods during 1990, 1994 and 1995. Trapped material was analysed for suspended particulate matter (SPM), total organic carbon (TOC) and nitrogen (TN), Cu, and Al. Only about 10% of the Cu from the river is trapped in the estuary. Still there was a moderate but significant reduction in Cu concentration in the trap SPM from 1990 to 1994, reflecting the industrial reductions, but only if excluding summer samples apparently influenced by antifouling Cu from boat paint. Settling matter therefore seems appropriate and sensitive for monitoring changes in the Cu load. The results supported the view that TOC is the main carrier of Cu to the sediments.",2002,Feb,Mar Pollut Bull,44,2,149-55,,10.1016/s0025-326x(01)00195-3,11981979,#557,Helland 2002,,Cu environmental chemistry; freshwater; pre-2010; primary source; sediment
"Levels and distribution of trace metals in surface sediments from Kongsfjorden, Svalbard, Norwegian Arctic.",Lu Z; Cai M; Wang J; Yin Z; Yang H,"Trace metal contents (Cd, Co, Cr, Cu, Hg, Mn, Ni, Pb and Zn) have been measured in 27 surface sediment samples collected from Kongsfjorden, Svalbard, Norwegian Arctic. The analyses yielded concentration values (in mg kg(-1)) of 0.13-0.63 for Cd, 11.89-21.90 for Co, 48.65-81.84 for Cr, 21.26-36.60 for Cu, 299.59-683.48 for Mn, 22.43-35.39 for Ni, 10.68-36.59 for Pb, 50.28-199.07 for Zn and 8.09-65.34 for Hg (in ng g(-1)), respectively. Relative cumulative frequency method has been used to define the baseline values of these metals, which (in mg kg(-1)) were 0.14 for Cd, 13.56 for Co, 57.86 for Cr, 25.14 for Cu, 364.08 for Mn, 26.22 for Ni, 17.46 for Pb, 70.49 for Zn and 9.76 for Hg (in ng g(-1)), respectively. The enrichment factor analysis indicated that Hg showed some extent of anthropogenic pollution, while Pb, Zn and Cd showed limited anthropogenic contamination in the study areas.",2013,Apr,Environ Geochem Health,35,2,257-69,,10.1007/s10653-012-9481-z,22965895,#573,Lu 2013,,marine; primary source; sediment
Heavy metals in zooplankton and decapod crustaceans from the Barents Sea.,Zauke GP; Schmalenbach I,"Trace metals (Cd, Cu, Pb and Zn) were analysed in zooplankton samples and decapod crustaceans collected on cruises of ""RV Walther Herwig III"" to the Barents Sea (Summer 1991, 1994 and 2000). We found a substantial spatial heterogeneity in the decapod crustacean Pandalus borealis, with increasing Cd concentrations from the south (North Cape Bank; 0.7 mg kg(-1) DW) to the north (north of Svalbard; 4.7 mg kg(-1)), supporting the hypothesis that the frequently reported Cd-anomaly in polar crustaceans might be extended to the Barents Sea. Regarding various crustaceans and zooplankton collectives (2000) a distinct interspecific heterogeneity of metals was obvious, with lowest Cd concentrations in euphausiids and chaetognaths and highest ones in decapods and hyperiid amphipods; lowest Cu concentrations in chaetognaths and copepods and highest ones in euphausiids and decapods; and lowest Zn concentrations in euphausiids and decapods and highest ones in some copepods. For Pb many values were below or close to the limit of detection, suggesting that Pb concentrations about 0.4 mg kg(-1) might serve as a regional background value. Results for Cd, Cu and Zn in copepods of this study are largely within the reported range, but high Cd concentrations in copepods from summer in contrast to reported lower ones during winter/spring may be related either to changing accumulation strategies of the copepod species involved or to seasonally changing Cd absorption in copepods from food.",2006,Apr,Sci Total Environ,359,01-Mar,283-94,,10.1016/j.scitotenv.2005.09.002,16194562,#576,Zauke 2006,,Cu biology; biota; marine; pre-2010; primary source
Impacts of climate change on metal leaching and partitioning for submarine mine tailings disposal.,Pedersen KB; Lejon T; Jensen PE; Ottosen LM; Frantzen M; Evenset A,"At present, there are no standardised tests to assess metal leaching during submarine tailings discharge. In this study the influence of variables known to affect metal mobility and availability (dissolved organic carbon (DOC), pH, salinity, temperature, aerated/anoxic conditions) along with variables affected by the discharge conditions (flocculant concentration, suspension) were studied in bench-scale experiments. The leaching tests were developed based on the case of a copper mine by Repparfjorden, northern Norway, which is planned to re-open in 2022. The experiments, which had three week duration, revealed low (<6 %) leaching of metals. Multivariate analysis showed that all variables, apart from DOC, highly influenced leaching and partitioning of at least one metal (Ba, Cr, Cu, and/or Mn). The high quantity of the planned annual discharge of mine tailings to the fjord (1-2 million tonnes) warranted estimation of the leached quantity of metals. Multivariate models, using present-day conditions in the fjord, estimated leaching of up to 124 kg Ba, 154 kg Cu and 2400 kg Mn per year during discharge of tailings. Future changes in the fjord conditions caused by climate change (decreased pH, increased temperature) was predicted by the multivariate models to increase the leaching up to 55 %, by the year 2065. The bench-scale experiments demonstrated the importance of including relevant variables (such as pH, salinity, and temperature) for metal leaching and -partitioning in leaching tests. The results showed that metal leaching during discharge is expected and will increase in the future due to the changed conditions caused by the foreseen climate change, and thereby underline the importance of monitoring metal concentrations in water during operations to determine the fate of metals in the fjord.",2022,Nov,Mar Pollut Bull,184,,114197,,10.1016/j.marpolbul.2022.114197,36208554,#588,Pedersen 2022,,Cu environmental chemistry; marine; primary source; projection/estimation; sediment
Trace metals in skeletal calcite of echinoderms from the Barents Sea.,Iglikowska A; Piwoni-Piórewicz A; Cieślik BM; Żyłan D; Waszczuk P; Kukliński P,"This study investigates the skeletal accumulation of selected elements (Al, Ag, As, Ca, Co, Cr, Cu, Fe, Hg, K, Mg, Mn, Na, Pb, Sr, Zn) in echinoderms inhabiting Barents Sea, an area impacted by human activities from northern Norway and Kola Peninsula, known sources of metal pollution. The primary aim was to have insight whether metals incorporation in the skeleton of Arctic echinoderms is regulated physiologically by the organism or influenced by abiotic environmental conditions (expressed as distance from the source of metal pollution). Metal concentrations were analysed in 17 species from four echinoderm classes: Asteroidea, Ophiuroidea, Crinoidea and Echinoidea. The results revealed species-specific accumulation patterns for most metals, indicating a strong biological control over metal incorporation. In crinoid Heliometra glacialis, a negative correlation between body size and skeletal concentrations of Al, Fe, Mg and Mn was observed. This correlation was ascribed to age-related metabolic traits and a likely mechanism for removing foreign metals from the skeletal calcite. The relationships between environmental factors and metal accumulation patterns were less clear. However, higher concentrations of Al, Fe, Mg, Mn and Pb were found in suspension feeders collected near glaciers, which were potential sources of suspended material. Asteroids exhibited particularly high concentrations of Cu, Fe, Cr, Hg compared to species from the other regions, suggesting that their calcified skeletons may serve as storage mechanisms to prevent toxic effects in other body parts. These observations confirm that biologically-mediated processes predominantly govern metal bioaccumulation in Arctic echinoderms.",2024,Nov,Chemosphere,367,,143635,,10.1016/j.chemosphere.2024.143635,39490763,#592,Iglikowska 2024,,Cu biology; biota; marine
