Title,Authors,Abstract,Published Year,Published Month,Journal,Volume,Issue,Pages,Accession Number,DOI,Ref,Covidence #,Study,Notes,Tags
Water chemistry of tundra lakes in the periglacial zone of the Bellsund Fiord (Svalbard) in the summer of 2013,"Szuminska, D; Szopinska, M; Lehmann-Konera, S; Franczak, L; Kociuba, W; Chmiel, S; Kalinowski, P; Polkowska, Z","Climate changes observed in the Arctic (e.g. permafrost degradation, glacier retreat) may have significant influence on sensitive polar wetlands. The main objectives of this paper arc defining chemical features of water within six small arctic lakes located in Bellsund (Svalbard) in the area of continuous permafrost occurrence. The unique environmental conditions of the study area offer an opportunity to observe phenomena influencing water chemistry, such as: chemical weathering, permafrost thawing, marine aerosols, atmospheric deposition and biological inputs. In the water samples collected during the summer 2013, detailed tundra lake water chemistry characteristics regarding ions, trace elements, pH and specific electrolytic conductivity (SEC25) analysis were determined. Moreover, water chemistry of the studied lakes was compared to the water samples from the Tyvjobekken Creek and precipitation water samples. As a final step of data analysis, Principal Component Analysis (PCA) was performed. Detailed chemical analysis allowed us to conclude what follows: (1) Ca2+, Mg2+, SO4(2-), Sr are of geogenic origin, (2) NO3(-) present in tundra lakes and the Tyvjobekken Creek water samples (ranging from 0.31 to 1.69 mg L-1 and from 0.25 to 1.58 mg L-1 respectively) may be of mixed origin, i.e. from biological processes and permafrost thawing, (3) high contribution of non-sea-salt SO42- > 80% in majority of studied samples indicate considerable inflow of sulphate-rich air to the study area, (4) high content of chlorides in tundra lakes (range: 25.6-32.0% meq L-1) indicates marine aerosol influence, (5) PCA result shows that atmospheric transport may constitute a source of Mn, Co, Ni. Cu, Ga, Ba and Cd. However, further detailed inter-season and multi-seasonal study of tundra lakes in the Arctic are recommended. Especially in terms of detailed differentiation of sources influence (atmospheric transport vs. permafrost degradation). (C) 2017 Elsevier B.V. All rights reserved.",2018,,SCIENCE OF THE TOTAL ENVIRONMENT,624,,1669-1679,WOS:000426355900163,10.1016/j.scitotenv.2017.10.045,,#86,Szuminska 2018,PIERRE  BLEVIN (2025-07-15 17:08:16)(Screen): can be seen as a source in marine ecosystem?; ,freshwater; primary source; terrestrial
Multi-isotopic composition of brown crab (Cancer pagurus) and seafloor sediment from a mine tailing sea disposal impacted fjord ecosystem,"Bank, MS; Ho, QT; Kutti, T; Kögel, T; Rodushkin, I; van der Meeren, T; Wiech, M; Rastrick, S","Sea disposal of mine tailings in fjord ecosystems is an important coastal management issue in Norway and occurs at the land -sea interface. Here we studied accumulation of heavy metals in brown crab (Cancer pagurus) and seafloor sediment from J & oslash;ssingfjord, Norway during 2018 to evaluate long-term, legacy pollution effects of coastal mine tailing sea disposal activities. Nickel and copper sediment pollution in the mine tailing sea disposal area was classified as moderate and severe, respectively, under Norwegian environmental quality standards, and highlights the persistent hazard and legacy impacts of heavy metals in these impacted fjord ecosystems. Mercury, zinc, and arsenic had stronger affinities to brown crab muscle likely due to the presence of thiols, and availability of metal binding sites. Our multi -isotopic composition data showed that lead isotopes were the most useful source apportionment tool for this fjord. Overall, our study highlights the importance and value of measuring several different heavy metals and multiple isotopic signatures in different crab organs and seafloor sediment to comprehensively evaluate fjord pollution and kinetic uptake dynamics. Brown crabs were suitable eco-indicators of benthic ecosystem heavy metal pollution in a fjord ecosystem still experiencing short- and long-term physical and chemical impacts from coastal mining sea disposal activities.",2024,,JOURNAL OF HAZARDOUS MATERIALS,471,,,WOS:001237148000001,10.1016/j.jhazmat.2024.134406,,#88,Bank 2024,,Cu biology; biota; marine; sediment
"Impacts of anthropogenic activities and glacial processes on the distribution of chemical elements in Billefjord, Svalbard, Arctic","Souza-Kasprzyk, J; Kozak, L; Niedzielski, P","The Arctic region is undergoing rapid and extensive transformations due to global climate change. This study investigated the spatial distribution of 31 chemical elements in eight locations in Billefjord, Svalbard, Arctic, with varying degrees of anthropogenic and glacial influences. The west coast of Billefjord has experienced a greater historical anthropogenic impact, while the east coast has larger glaciers and shows less visible evidence of direct human impact. Over 450 topsoil samples collected in the west (abandoned mining town Pyramiden, and glacial valleys of Elsa, Ferdinand, Sven) and east coast of the fjord (glacial valleys of Ebba, Pollock, Ragnar and nearby the Nordenskio center dot ld glacier). These samples were extracted and analyzed by ICP-OES. The results revealed complex distributions of elements among the locations. Nordenskio center dot ld glacier area, along with other locations in the eastern part of the Billefjord, had significantly higher levels of most elements (20 out of 31; As, B, Ca, Cd, Co, Cr, Cu, K, Li, Mg, Mo, Sb, Se, Sn, Sr, Ti, Tl, U, V, Zr). In contrast, Ferdinand Valley and other locations on the western side of the fjord had the lowest mean concentrations of most elements (18 out of 31; B, Ca, Cu, Cd, K, Li, P, Mg, Mo, Sb, Se, Sn, Sr, Ti, Tl, U, V, Zr). These findings highlight the significant influence of glacial processes on the elemental composition of soils within the region. The meltwater flow originating from glaciers in the sampled valleys contributes to the local element load, while the loss of glacier mass is associated with decreased element concentrations within these valleys. These results underscore the complexity of element distribution in the study area and emphasize the necessity for continuous monitoring efforts in this unique and environmentally sensitive region.",2024,,SCIENCE OF THE TOTAL ENVIRONMENT,909,,,WOS:001119268500001,10.1016/j.scitotenv.2023.168534,,#89,Souza-Kasprzyk 2024,,primary source; sediment; terrestrial
The results of measurements of heavy metals in atmospheric aerosols in the open areas of the Arctic Seas in 2009-2010,"Golubeva, NI; Burtseva, LV; Matishov, GG; Il'in, GV","By experimental data on the concentration of toxic microelements (Pb, Cd, Cu, Zn, Ni, Co, and Cr) in atmospheric aerosols over the White and Norwegian Seas in winter-spring period of 2009-2010, the contamination of air environment over two sea basins, significantly different by geographical conditions but being heavily impacted by North-European industrial centres, including the impact of the largest in the European Arctic Kola industrial centre, has been analyzed. It has been indicated and described that the air basin over the White Sea water area, when compared to the Norwegian Sea, is under a significantly greater impact of the emission sources of heavy metals, located on the Kola Peninsula.",2013,,DOKLADY EARTH SCIENCES,453,1,1090-1093,WOS:000328228300005,10.1134/S1028334X13110019,,#93,Golubeva 2013,,air; marine; primary source
Elemental Distribution in Tissues of Shorthorn Sculpins (Myoxocephalus scorpius) from Kongsfjorden in Svalbard,"Ardini, F; Moggia, F; Di Blasi, D; Rivaro, P; Grotti, M; Ghigliotti, L","The shorthorn sculpin (Myoxocephalus scorpius) is considered a suitable sentinel species for marine pollution in the Arctic due to its ecology and stationary habits. To evaluate its role as a bioindicator for potential natural and anthropic impacts on the marine ecosystem of the Kongsfjorden (Svalbard, Norwegian Arctic), 33 female and male specimens of shorthorn sculpins were collected in July 2018 in proximity of the Ny-& Aring;lesund international research facility and analyzed for the content of 25 major and trace elements and methylmercury (MeHg) in the muscle, liver, gonads, and gills by using spectroscopic techniques. Most elements had their maximum average concentrations in the gills (Al, Cr, Fe, Mn, Na, Ni, Pb, Se, Si, Sr, and V), while the livers featured higher contents of some toxic and heavy metals (As, Cd, Cu, Mo, and Zn). The muscle was characterized by high contents of Ca, K, and Mg, while Ba, Co, and P were mostly concentrated in the gonads. The gonads presented higher concentrations of Cr, K, Mg, Ni, P, and V for the males and Co, Cu, Fe, Mn, and Se for the females. Both the total Hg and MeHg concentrations in the muscle correlated with the fish size, indicating bioaccumulation, although high Se/Hg molar ratios (11.0 +/- 2.2) suggested a low toxic potential of mercury.",2024,,JOURNAL OF MARINE SCIENCE AND ENGINEERING,12,12,,WOS:001387677100001,10.3390/jmse12122245,,#94,Ardini 2024,,Cu biology; biota; primary source
Pollution of Russian Northern Seas with Heavy Metals: Comparison of Atmospheric Flux and River Flow,"Vinogradova, AA; Kotova, EI","Fluxes of anthropogenic heavy metals (Pb, Cd, As, Zn, Ni, Cr, and Cu) to the surface of four seas (White, Pechora, Kara, and Laptev seas) in the Russian Arctic have been estimated in this work using previously calculated concentrations of these elements in the surface atmosphere in some island and continental points of the Arctic Ocean. The obtained values were compared with the published data on the fluxes of the same components carried by waters flowing into the seas. Based on EMEP reports, we made some corrections for the data on lead and cadmium fluxes from the atmosphere to White and Pechora sea waters, taking into account pollution sources from European countries and the contribution of processes of the raising of dust and soil particles by wind to the pollution of the European part of Russia. On the whole, the contribution of atmospheric fluxes of HMs to the formation of the environment composition of northern Russian seas is significantly lower than that of the runoff of rivers flowing into the seas. The White Sea is the exception; it is exposed to numerous anthropogenic sources of HM emissions into the atmosphere. It is also reasonable to expect the atmospheric transport of HMs to make a significant contribution to these waters. One can also expect a significant contribution of the atmospheric transport of HMs to waters of distant seas (the Kara and Laptev seas), namely, in the parts of these seas where the influence of largest Siberian rivers (Ob, Yenisei, and Lena) is insignificant.",2019,,IZVESTIYA ATMOSPHERIC AND OCEANIC PHYSICS,55,7,695-704,WOS:000504189200003,10.1134/S0001433819070119,,#99,Vinogradova 2019,PIERRE  BLEVIN (2025-07-14 18:22:09)(Screen): Pechora sea is part of the geo area based on the map I see on the protocole; Sam Welch (2025-07-10 16:56:27)(Screen): may be out of spatial scope?; ,marine; projection/estimation; terrestrial
Atmospheric Transport of Anthropogenic Heavy Metals from the Kola Peninsula to the Surfaces of the White and Barents Seas,"Vinogradova, AA; Maksimenkov, LO; Pogarskii, FA","The propagation of air masses and anthropogenic aerosol pollutants from a large industrial region located above the polar circle in the north of the Kola Peninsula is analyzed. The initial data are five-day-traveltime trajectories of air mass transport from the source, which were calculated for each day of January, April, July, and October over a period of 20 years from 1981 to 2000 according to the NOAA reanalysis data on meteorological fields. Seasonal and long-term variations in the mean concentrations of arsenic and heavy metals (Ni, Cu, Pb, Cd, V) in the surface air layer and precipitation over the waters of the White and Barents seas are studied. The results are compared with the published observational data characteristic of the region under study. It is shown that, on the whole, over a year, the atmospheric flux of persistent ecotoxicants from the Kola Peninsula to the waters of the White and Barents seas is fully comparable to the contribution of their inflowing rivers and this flux is dominant for nickel and copper.",2008,,IZVESTIYA ATMOSPHERIC AND OCEANIC PHYSICS,44,6,753-762,WOS:000261654500009,10.1134/S0001433808060091,,#101,Vinogradova 2008,,air; marine; pre-2010; terrestrial
Green sea urchins (Strongylocentrotus droebachiensis) as potential biomonitors of metal pollution near a former lead-zinc mine in West Greenland,"Sondergaard, J; Hansson, SV; Mosbech, A; Bach, L","In this study, metal accumulation in green sea urchins (Strongylocentrotus droebachiensis) was investigated near the former Black Angel lead-zinc mine in Maarmorilik, West Greenland. Sea urchins (n = 9-11; 31-59 mm in diameter) were collected from three stations located at < 1 km, 5 km, and 12 km (reference site) away from the former mine site, respectively. After collection, tissue of the sea urchins was divided into gonads and remaining soft parts (viscera) before subjected to chemical analyses. Focus was on eight elements found in elevated concentrations in the mine waste (iron, copper, zinc, arsenic, silver, cadmium, mercury and lead). Sea urchins at the mine site contained significantly more copper, mercury and lead compared with the reference site for both the gonads and viscera, while the latter also contained significantly more iron, zinc and silver. Arsenic and cadmium were not significantly elevated in sea urchins at the mine site. Most elements were found in higher concentrations in the viscera compared with the gonads. For comprehensive monitoring of metal pollution at mine sites, a diverse selection of monitoring organisms is necessary. The study shows that green sea urchins accumulate selected metals and can be used as a monitoring organism for mining pollution, at least for iron, copper, zinc, silver, mercury and lead. However, the results also show that green sea urchins are less likely to reflect small environmental changes in loading of most metals (except iron, copper and silver) and for arsenic compared to suspension feeders such as blue mussels.",2019,,ENVIRONMENTAL MONITORING AND ASSESSMENT,191,9,,WOS:000480243200003,10.1007/s10661-019-7637-3,,#105,Sondergaard 2019,,biota; marine; primary source
"Metals in some dominant vascular plants, mosses, lichens, algae, and the biological soil crust in various types of terrestrial tundra, SW Spitsbergen, Norway","Wojtun, B; Samecka-Cymerman, A; Kolon, K; Kempers, AJ; Skrzypek, G","Arctic environments are commonly considered to be relatively pristine because of minimal local human activity. However, these areas receive air pollution from lower latitude regions. Our goal was to determine concentrations of metals (Cd, Co, Cr, Cu, Fe, Hg, Mn, Ni, Pb, and Zn) in dominant species of vascular plants, mosses, lichens, algae, and in the biological soil crust (BSC), and topsoil (0-3 cm) from various types of tundra in the southwestern part of Spitsbergen, Norway. Results indicate that mosses are more efficient bioaccumulators of Cd, Co, Cr, Cu, Fe, Mn, and Zn than lichens. The highest levels of Co, Cr, Cu, Fe, Hg, Mn, Ni, and Pb were found in the BSC, and the moss species Racomitrium lanuginosum, Sanionia uncinata, and Straminergon stramineum from the polygonal tundra, initial cyanobacteria-moss wet tundra, snow bed cyanobacteria-moss tundra, and flow water moss tundra alimented by melting ice or snow. The observed higher concentrations of Cu and lower concentrations of Hg in mosses, lichens, and vascular plants compared with values observed 20 years earlier were apparently associated with changes in the atmospheric deposition of contaminants over Spitsbergen due to changes in the long-distance transport of anthropogenic emissions from industrialized areas. Prasiola crispa and Salix polaris may be useful bioindicators of Cd and Zn, and the BSC, R. lanuginosum, S. uncinata, and S. stramineum as bioindicators of Co, Cr, Cu, Fe, Hg, Mn, Ni, and Pb. These results may be extrapolated across other areas of Spitsbergen with similar climates.",2013,,POLAR BIOLOGY,36,12,1799-1809,WOS:000327393700008,10.1007/s00300-013-1399-0,,#106,Wojtun 2013,PIERRE  BLEVIN (2025-07-16 05:15:53)(Screen): Can be seen as a source in marine ecosystem; ,Cu biology; biota; primary source; terrestrial
"Metal Distributions in Tigriopus brevicornis (Crustacea, Copepoda) Exposed to Copper, Zinc, Nickel, Cadmium, Silver, and Mercury, and Implication for Subsequent Transfer in the Food Web","Barka, S; Pavilion, JF; Amiard-Triquet, C","The marine copepod Tigriopus brevicornis is a benthic microcrustacean inhabiting splashed rock pools in the intertidal zone. The genus has a worldwide distribution, and some species play an important role as a link in trophic webs. It is well established that many crustaceans are able to survive in contaminated environments by storing metallic pollutants in detoxified form, and thus, they may represent a source of contaminants for their predators. The present study was designed to determine the distribution of bioaccumulated metals, both essential and nonessential, with a view to assessing their availability to the next trophic level. Groups of 1000-1500 adult copepods were exposed for 1-14 days to Ag, Cd, Cu, Hg, Ni, and Zn in water. Three concentrations, chosen to be realistic in comparison with those encountered in polluted environments, were tested for each metal. Copepods were homogenized and metals were analyzed in supernatants (i.e., metals stored in soluble form in soft tissues or easily remobilized from the exoskeleton) and pellets (including metal-rich detoxificatory granules or with cellular debris) recovered after centrifugation. Another experiment, consisting of desorption tests, was designed to evaluate the fraction of metals loosely bound onto the exoskeleton. The bioaccumulation ability is highly variable, as shown by the ratios between the concentrations reached in T brevicornis experimentally exposed to different metals (at higher dose and at day 14) and those in controls (7, 12, 18, 26, 53, and 99, respectively, for Zn, Cu, Ni, Cd, Ag, and Hg). Cu, Zn, and Ni concentrations in copepods increased linearly with time over the whole range of exposure concentrations, whereas a plateau body metal concentration was reached with time particularly at the highest exposure concentrations for Cd, Ag, and Hg. Metals bound onto the exoskeleton were remobilized to different extents, the percentages of desorption being 11, 14, 16, 19, 31, and 32, respectively, for Zn, Cd, Cu, Ni, Ag, and Hg. Metals mainly present in the supernatant (Cd, Ni, Zn) are probably more able to be transferred along a food chain than those which were equally distributed between soluble and insoluble fractions (Ag, Cu, and Hg). (C) 2009 Wiley Periodicals, Inc. Environ Toxicol 25: 350-360, 2010.",2010,,ENVIRONMENTAL TOXICOLOGY,25,4,350-360,WOS:000280035900005,10.1002/tox.20505,,#112,Barka 2010,"Knut Erik Tollefsen Tollefsen (2025-07-16 17:46:43)(Screen): agree to that as it determines accumulation. Claim is that speices has woorldwide distribution as well  ; Sam Welch (2025-07-08 20:43:22)(Screen): this is technically out of scope as a lab study, but we may well wish to come back to it later; ",North Atlantic only; biota; lab study; marine
"A study of metal concentrations and metallothionein binding capacity in liver, kidney and brain tissues of three Arctic seal species","Sonne, C; Aspholm, O; Dietz, R; Andersen, S; Berntssen, MHG; Hylland, K","Arctic seals are known to accumulate relatively high concentrations of potential toxic heavy metals in their vital organs. such as livers and kidneys, as well as in their central nervous system. We therefore decided to determine whether mercury, copper, cadmium and zinc levels in liver, kidney and brain tissues of three Arctic seal species were associated with the intracellular metal-binding protein metallothionein (MT) as a sign of toxic exposure. Samples from four ringed (Phoca hispida), five harp (P. groenlandica) and five hooded (Cystophona cristata) seals taken during field trips to Central West Greenland (Godhavn) and the Barents Sea in the spring of 1999 were used for the present study. In all three seal species concentrations of mercury. zinc and copper were highest in the liver, except for cadmium which was highest in the kidneys. Metal concentrations increased significantly in the order: ringed seal < harp seal <hooded seal for both kidney and liver tissues. MT concentrations were highest in the kidneys and the concentrations increased in the order: ringed seal < hooded seal < harp seal. MIT metal-binding capacity was highest in the kidneys for all three species and increased in the same order: ringed seals (2-10%) < hooded seals (8-15%) < harp seals (27-63%). We therefore suggest that there are species-specific differences in the sub-cellular handling of heavy metals which indicate differences in sensitivity and health implications. However, a larger sample size is needed in order to test the relationship between metal concentrations and MT up-regulation in order to decide which metals are the most important and to elucidate whether the MT binding capacity is sufficient to protect tissues (i.e. kidney) from metal toxicosis. MT with its binding capacity could be a useful marker for environmental exposure to metals and their potential toxicity in the Arctic. (C) 2009 Elsevier B.V. All rights reserved.",2009,,SCIENCE OF THE TOTAL ENVIRONMENT,407,24,6166-6172,WOS:000272153000007,10.1016/j.scitotenv.2009.08.029,,#114,Sonne 2009,,Cu biology; biota; marine; pre-2010
Geochemical assessment of gold mine tailings proposed for marine tailings disposal,"Matthies, R; Bowell, RJ; Williams, KP","A preliminary geochemical study on gold mine tailings proposed for marine tailings disposal has been undertaken to identify the potential release of acidity and ecotoxic elements. Laboratory tests investigated the effects of flushing media, temperatures and light-exposure on the reactivity and acid generation potential of the tailing. Based on low sulphide and carbonate concentrations, ambiguous static test results categorized the tailing as 'uncertain to potential-acid-generating'. Over a 20-week kinetic test programme, tailing leachates remained circum-neutral and metal release rates decreased substantially after the first-flush. However, Canadian Interim Quality guidelines for marine sediment were exceeded for As, Cd, Cr, Cu, Pb and Zn by factors ranging between 1.5 (Zn) and 196 (As) and kinetic leachate concentrations of Cd exceeded Canadian Marine Aquatic Life guidelines suggesting potentially harmful effects might occur upon disposal of the tailing in marine environment. Leaching of ecotoxic elements was enhanced by the use of seawater as flushing medium. Changes in temperature and light exposure had only minor effects. In-situ long-term (> 20 weeks) leaching tests are proposed.",2011,,GEOCHEMISTRY-EXPLORATION ENVIRONMENT ANALYSIS,11,1,41-50,WOS:000286803000003,10.1144/1467-7873/09-016,,#118,Matthies 2011,,lab study; marine; primary source
Elemental composition of Arctic soils and aerosols in Ny-Ålesund measured using laser -induced breakdown spectroscopy,"Kim, G; Yoon, YJ; Kim, HA; Cho, HJ; Park, K","Two laser-induced breakdown spectroscopy (LIBS) systems (soil LIBS and aerosol LIBS) were used to determine the elemental composition of soils and ambient aerosols less than 2.5 mu m in Ny-Alesund, Svalbard (the world's most northerly human settlement). For soil LIBS measurements, matrix effects such as moisture content, soil grain size, and surrounding gas on the LIBS response were minimized. When Ar gas was supplied onto the soil sample surfaces, a significant enhancement in LIBS emission lines was observed. Arctic soil samples were collected at 10 locations, and various elements (Al, Ba, C, Ca, Cu, Fe, H, K, Mg, Mn, N, Na, O, Pb, and Si) were detected in soils. The elemental distribution in arctic soils was clearly distinguishable from those in urban and abandoned mining soils in Korea. Moreover, the concentrations of most of anthropogenic metals were fairly low, and localized sources in extremely close proximity affected the elevated level of Cu in the soil samples derived from Ny-Alesund. The number of elements detected in aerosols (C, Ca, H, K, Mg, Na, and 0) was lower than those determined in soils. The elements in aerosols can mainly originate from minerals and sea salts. The elemental distribution in aerosols was also clearly distinguishable from that in soils, suggesting that the resuspension of local soil particles by wind erosion into aerosols was minimal. The daily variation of particle number concentration (RSD = 71%) and the elements in aerosols (RSD = 25%) varied substantially, possibly due to fluctuating air masses and meteorological conditions. (C) 2017 Elsevier B.V. All rights reserved.",2017,,SPECTROCHIMICA ACTA PART B-ATOMIC SPECTROSCOPY,134,,17-24,WOS:000407535700004,10.1016/j.sab.2017.06.006,,#121,Kim 2017,,primary source; terrestrial
